Sesión de chat,Fecha del mensaje,Fecha de envío,Tipo,ID del remitente,Nombre del remitente,Estado,Reenviado,Respuesta para,Texto,Reacciones,Adjunto,Tipo de adjunto,Información del adjunto
Amelia Brooks 11001,2026-03-11 09:00:00,,Notificación,,,,,,Messages and calls are end to end encrypted.,,,,
Amelia Brooks 11001,2026-03-11 09:01:04,2026-03-11 09:01:07,Entrante,+15550011001,Amelia Brooks,Leído,,,Hi I want to buy chispitas for a birthday party,,,,
Amelia Brooks 11001,2026-03-11 09:02:10,2026-03-11 09:02:11,Saliente,,,Leído,,,Great We have classic and neon chispitas packs,,,,
Amelia Brooks 11001,2026-03-11 09:03:21,2026-03-11 09:03:24,Entrante,+15550011001,Amelia Brooks,Leído,,,Can you show me the neon options,,,,
Amelia Brooks 11001,2026-03-11 09:04:05,2026-03-11 09:04:05,Saliente,,,Leído,,,Sure sharing the latest catalog,,chispitas_neon_catalog.jpg,image/jpeg,image/jpeg 1280x720
Amelia Brooks 11001,2026-03-11 09:05:48,2026-03-11 09:05:50,Entrante,+15550011001,Amelia Brooks,Leído,,,Perfect I need 12 jars for Saturday,,,,
Amelia Brooks 11001,2026-03-11 09:06:32,2026-03-11 09:06:33,Saliente,,,Leído,,,Done I will prepare a quote and delivery options,,,,
